{"chunks":[{"length":8192,"sha256":"4862f447f2c7f272fa2f4aaf89dadb3b1ac09105bd5864f8d1a0c9452bb0a226"},{"length":64,"sha256":"0c62f876ef1dea830de9f32c2f4b46dd6d74d50d15896e09ef5a2fcd4ac7e1d7"}],"components":{"..":{"tensors":{"a.weight":{"data":{"chunk":0,"length":12,"offset":0},"dtype":"BF16","shape":[2,3]},"b.weight":{"dtype":"F32","encoding":{"params":{"axis":0},"scheme":"fp8-rowwise"},"parts":{"scale":{"chunk":1,"dtype":"F32","length":16,"offset":0,"shape":[4]},"weight":{"chunk":0,"dtype":"F8_E4M3","length":4096,"offset":4096,"shape":[4,1024]}},"shape":[4,1024]}}}},"format":"cozytensors/2","metadata":{"prompt":"a cat"}}